[
  {"utt_id": "u1", "text": "我们品牌一路走来不容易感谢陪伴", "t0_ms": 0, "t1_ms": 5000},
  {"utt_id": "u2", "text": "袖口有隐形松紧不勒肉", "t0_ms": 6000, "t1_ms": 11000},
  {"utt_id": "u3", "text": "身高160建议穿M偏小拍大一码", "t0_ms": 12000, "t1_ms": 18000},
  {"utt_id": "u4", "text": "梨形姐妹遮胯显瘦闭眼入", "t0_ms": 20000, "t1_ms": 26000}
]
